{
  "$schema": "http://json-schema.org/draft-07/schema#",
  "$id": "https://pmcram.app/schema/pointclick.schema.json",
  "title": "PM Cram point-and-click question",
  "description": "A 2026-style point-and-click question: a graphic with hidden hotspot regions. The candidate taps the correct location(s) on the image. The figure is a theme-aware inline SVG; regions are rectangular hotspots in the SVG's viewBox coordinate space. id is optional (derived).",
  "type": "object",
  "required": ["prompt", "figure", "regions"],
  "additionalProperties": false,
  "properties": {
    "schema": { "type": "string", "const": "pointclick/v1" },
    "id": { "type": "string", "description": "OPTIONAL — derived from content if omitted.", "pattern": "^[a-z0-9][a-z0-9-]*$" },
    "domain": { "type": "string", "enum": ["People", "Process", "Business Environment"] },
    "topic": { "type": "string" },
    "difficulty": { "type": "string", "enum": ["easy", "medium", "hard"] },
    "prompt": { "type": "string", "description": "The question / instruction (e.g. 'Tap the activity that is NOT on the critical path')." },
    "figure": {
      "type": "object",
      "required": ["svg"],
      "additionalProperties": false,
      "properties": {
        "svg": { "type": "string", "description": "Inline theme-aware <svg> with a viewBox (use currentColor for ink). Regions are positioned in this viewBox's coordinate space." },
        "caption": { "type": "string" }
      }
    },
    "regions": {
      "type": "array",
      "minItems": 2,
      "description": "Rectangular hotspots, in the figure's viewBox coordinates. At least one must be correct.",
      "items": {
        "type": "object",
        "required": ["id", "x", "y", "w", "h"],
        "additionalProperties": false,
        "properties": {
          "id": { "type": "string", "description": "Unique within the question." },
          "x": { "type": "number" },
          "y": { "type": "number" },
          "w": { "type": "number", "exclusiveMinimum": 0 },
          "h": { "type": "number", "exclusiveMinimum": 0 },
          "correct": { "type": "boolean", "description": "True for a correct hotspot (default false)." },
          "label": { "type": "string", "description": "Short label shown on review for this region." },
          "why": { "type": "string", "description": "Why this region is right/wrong, shown on review." }
        }
      }
    },
    "select": { "type": "integer", "minimum": 1, "description": "How many hotspots to pick. Defaults to the number of correct regions." },
    "explanation": { "type": "string" },
    "references": { "type": "array", "items": { "type": "string" } },
    "tags": { "type": "array", "items": { "type": "string" } },
    "contributor": { "type": "string" }
  }
}
