[
  {
    "schema": "pointclick/v1",
    "domain": "Process",
    "topic": "Schedule",
    "difficulty": "medium",
    "prompt": "Total float = LS − ES. Tap the only activity that is NOT on the critical path.",
    "figure": {
      "svg": "<svg viewBox='0 0 320 210' xmlns='http://www.w3.org/2000/svg' fill='none'><rect x='14' y='46' width='56' height='46' rx='4' stroke='currentColor' stroke-width='1.4'/><text x='42' y='59' fill='currentColor' font-size='9' text-anchor='middle'>0 | 3</text><text x='42' y='73' fill='currentColor' font-size='11' text-anchor='middle'>A 3</text><text x='42' y='86' fill='currentColor' font-size='9' text-anchor='middle'>0 | 3</text><rect x='132' y='46' width='56' height='46' rx='4' stroke='currentColor' stroke-width='1.4'/><text x='160' y='59' fill='currentColor' font-size='9' text-anchor='middle'>3 | 8</text><text x='160' y='73' fill='currentColor' font-size='11' text-anchor='middle'>B 5</text><text x='160' y='86' fill='currentColor' font-size='9' text-anchor='middle'>3 | 8</text><rect x='250' y='46' width='56' height='46' rx='4' stroke='currentColor' stroke-width='1.4'/><text x='278' y='59' fill='currentColor' font-size='9' text-anchor='middle'>8 | 12</text><text x='278' y='73' fill='currentColor' font-size='11' text-anchor='middle'>D 4</text><text x='278' y='86' fill='currentColor' font-size='9' text-anchor='middle'>8 | 12</text><rect x='132' y='146' width='56' height='46' rx='4' stroke='currentColor' stroke-width='1.4'/><text x='160' y='159' fill='currentColor' font-size='9' text-anchor='middle'>3 | 5</text><text x='160' y='173' fill='currentColor' font-size='11' text-anchor='middle'>C 2</text><text x='160' y='186' fill='currentColor' font-size='9' text-anchor='middle'>6 | 8</text><line x1='70' y1='69' x2='132' y2='69' stroke='currentColor' stroke-width='1.4'/><polygon points='124,65 124,73 132,69' fill='currentColor'/><line x1='188' y1='69' x2='250' y2='69' stroke='currentColor' stroke-width='1.4'/><polygon points='242,65 242,73 250,69' fill='currentColor'/><line x1='44' y1='92' x2='140' y2='146' stroke='currentColor' stroke-width='1.4'/><polygon points='132,140 142,146 130,150' fill='currentColor'/><line x1='188' y1='160' x2='250' y2='92' stroke='currentColor' stroke-width='1.4'/><polygon points='244,98 252,86 254,98' fill='currentColor'/><text x='160' y='205' fill='currentColor' font-size='9' text-anchor='middle'>ES | EF on top  ·  LS | LF below</text></svg>",
      "caption": "Each box: ES|EF (top), LS|LF (bottom)."
    },
    "regions": [
      { "id": "a", "x": 14, "y": 46, "w": 56, "h": 46, "label": "A", "why": "0 float (LS = ES) — on the critical path." },
      { "id": "b", "x": 132, "y": 46, "w": 56, "h": 46, "label": "B", "why": "0 float — on the critical path." },
      { "id": "d", "x": 250, "y": 46, "w": 56, "h": 46, "label": "D", "why": "0 float — on the critical path." },
      { "id": "c", "x": 132, "y": 146, "w": 56, "h": 46, "correct": true, "label": "C", "why": "LS 6 ≠ ES 3 → 3 days of float, so C can slip without delaying the project." }
    ],
    "explanation": "The critical path A→B→D has zero float. Activity C has 3 days of total float (LS 6 vs ES 3), so it sits off the critical path.",
    "references": ["PMBOK Guide — Schedule management"],
    "tags": ["critical path", "float", "pointclick"]
  },
  {
    "schema": "pointclick/v1",
    "domain": "Process",
    "topic": "Quality",
    "difficulty": "medium",
    "prompt": "This control chart plots a process over time. Tap the point that signals the process is out of control.",
    "figure": {
      "svg": "<svg viewBox='0 0 320 190' xmlns='http://www.w3.org/2000/svg' fill='none'><line x1='40' y1='30' x2='300' y2='30' stroke='#B5462F' stroke-width='1.3' stroke-dasharray='4 4'/><line x1='40' y1='150' x2='300' y2='150' stroke='#B5462F' stroke-width='1.3' stroke-dasharray='4 4'/><line x1='40' y1='90' x2='300' y2='90' stroke='currentColor' stroke-width='1.3'/><polyline points='55,96 95,76 135,100 175,72 215,98 244,22 285,84' stroke='#1F5FA8' stroke-width='2'/><circle cx='55' cy='96' r='3.5' fill='#1F5FA8'/><circle cx='95' cy='76' r='3.5' fill='#1F5FA8'/><circle cx='135' cy='100' r='3.5' fill='#1F5FA8'/><circle cx='175' cy='72' r='3.5' fill='#1F5FA8'/><circle cx='215' cy='98' r='3.5' fill='#1F5FA8'/><circle cx='244' cy='22' r='3.5' fill='#1F5FA8'/><circle cx='285' cy='84' r='3.5' fill='#1F5FA8'/><text x='304' y='30' fill='#B5462F' font-size='10' text-anchor='end'>UCL</text><text x='304' y='150' fill='#B5462F' font-size='10' text-anchor='end'>LCL</text><text x='304' y='88' fill='currentColor' font-size='10' text-anchor='end'>mean</text></svg>",
      "caption": "UCL/LCL are the dashed control limits; the solid line is the mean."
    },
    "regions": [
      { "id": "p1", "x": 44, "y": 85, "w": 22, "h": 22 },
      { "id": "p2", "x": 84, "y": 65, "w": 22, "h": 22 },
      { "id": "p3", "x": 124, "y": 89, "w": 22, "h": 22 },
      { "id": "p4", "x": 164, "y": 61, "w": 22, "h": 22 },
      { "id": "p5", "x": 204, "y": 87, "w": 22, "h": 22 },
      { "id": "p6", "x": 233, "y": 11, "w": 22, "h": 22, "correct": true, "why": "This point is beyond the upper control limit — an out-of-control, special-cause signal." },
      { "id": "p7", "x": 274, "y": 73, "w": 22, "h": 22 }
    ],
    "explanation": "A process is out of control when a point falls outside the control limits (or shows a non-random run). Only the sixth point breaches the UCL.",
    "references": ["PMBOK Guide — Quality management"],
    "tags": ["control chart", "quality", "pointclick"]
  },
  {
    "schema": "pointclick/v1",
    "domain": "People",
    "topic": "RACI",
    "difficulty": "easy",
    "prompt": "In this RACI chart, tap the cell showing who is Accountable for the Charter.",
    "figure": {
      "svg": "<svg viewBox='0 0 330 175' xmlns='http://www.w3.org/2000/svg' fill='none'><line x1='10' y1='10' x2='320' y2='10' stroke='currentColor' stroke-width='1'/><line x1='10' y1='40' x2='320' y2='40' stroke='currentColor' stroke-width='1'/><line x1='10' y1='74' x2='320' y2='74' stroke='currentColor' stroke-width='0.8'/><line x1='10' y1='108' x2='320' y2='108' stroke='currentColor' stroke-width='0.8'/><line x1='10' y1='142' x2='320' y2='142' stroke='currentColor' stroke-width='1'/><line x1='10' y1='10' x2='10' y2='142' stroke='currentColor' stroke-width='1'/><line x1='120' y1='10' x2='120' y2='142' stroke='currentColor' stroke-width='1'/><line x1='170' y1='10' x2='170' y2='142' stroke='currentColor' stroke-width='0.6'/><line x1='220' y1='10' x2='220' y2='142' stroke='currentColor' stroke-width='0.6'/><line x1='270' y1='10' x2='270' y2='142' stroke='currentColor' stroke-width='0.6'/><line x1='320' y1='10' x2='320' y2='142' stroke='currentColor' stroke-width='1'/><text x='145' y='30' fill='currentColor' font-size='10' text-anchor='middle'>PM</text><text x='195' y='30' fill='currentColor' font-size='9' text-anchor='middle'>Sponsor</text><text x='245' y='30' fill='currentColor' font-size='10' text-anchor='middle'>Team</text><text x='295' y='30' fill='currentColor' font-size='10' text-anchor='middle'>QA</text><text x='16' y='61' fill='currentColor' font-size='10'>Charter</text><text x='16' y='95' fill='currentColor' font-size='10'>Plan</text><text x='16' y='129' fill='currentColor' font-size='10'>Build</text><text x='145' y='61' fill='currentColor' font-size='11' text-anchor='middle'>R</text><text x='195' y='61' fill='currentColor' font-size='11' text-anchor='middle'>A</text><text x='245' y='61' fill='currentColor' font-size='11' text-anchor='middle'>C</text><text x='295' y='61' fill='currentColor' font-size='11' text-anchor='middle'>I</text><text x='145' y='95' fill='currentColor' font-size='11' text-anchor='middle'>A</text><text x='195' y='95' fill='currentColor' font-size='11' text-anchor='middle'>C</text><text x='245' y='95' fill='currentColor' font-size='11' text-anchor='middle'>R</text><text x='295' y='95' fill='currentColor' font-size='11' text-anchor='middle'>I</text><text x='145' y='129' fill='currentColor' font-size='11' text-anchor='middle'>A</text><text x='195' y='129' fill='currentColor' font-size='11' text-anchor='middle'>I</text><text x='245' y='129' fill='currentColor' font-size='11' text-anchor='middle'>R</text><text x='295' y='129' fill='currentColor' font-size='11' text-anchor='middle'>C</text></svg>",
      "caption": "R responsible · A accountable · C consulted · I informed."
    },
    "regions": [
      { "id": "pm", "x": 120, "y": 40, "w": 50, "h": 34, "label": "PM", "why": "R — Responsible, not Accountable." },
      { "id": "sponsor", "x": 170, "y": 40, "w": 50, "h": 34, "correct": true, "label": "Sponsor", "why": "A — Accountable for the Charter. There's exactly one A per row." },
      { "id": "team", "x": 220, "y": 40, "w": 50, "h": 34, "label": "Team", "why": "C — Consulted, not Accountable." },
      { "id": "qa", "x": 270, "y": 40, "w": 50, "h": 34, "label": "QA", "why": "I — Informed, not Accountable." }
    ],
    "explanation": "In RACI, A = Accountable, and there is exactly one A per row. For the Charter, the Sponsor holds the A.",
    "references": ["PMBOK Guide — Resource / Stakeholder management"],
    "tags": ["raci", "people", "pointclick"]
  }
]
